name,address,latitude,longitude,difficulty,satisfaction,tags,description_geography,description_nature,description_culture,image
Schramm Park SRA,15810 NE-31 Gretna NE 68028,41.0180,-96.2550,40,90,"Fish Hatchery History,Aquarium,Nature Center,Hiking Trails,Paved Paths,Steep Inclines,Wooded Bluffs,Platte River Views,Wildlife Sightings,Birdwatching,Photography Spot,Educational Signage,Visitor Center,Restrooms On-Site,Picnic Area,Playground,Family Friendly,Accessibility Friendly,Geological History,Fossil History,Native Plant Life,Deciduous Forest,Autumn Foliage,River Access,Canoe Access,Stargazing Spot,Butterfly Garden,Nature Photography,Eastern Nebraska,Historic Landmark,State's First Hatchery,Spring Fed,Suspension Bridge,Outdoor Classroom,Warbler Sightings,Mushroom Foraging,Quiet Walk,Cultural Heritage","Schramm Park is situated on the scenic bluffs of the Platte River and features some of the most unique topography in eastern Nebraska. The geography includes steep, timbered ridges and deep, cool ravines fed by natural springs. It is the site of the state's first fish hatchery, utilizing the limestone-filtered spring water that flows from the hills. The park's trails offer a more rugged hiking experience than most eastern parks, with significant elevation gains providing glimpses of the river through the trees.","The park's nature is characterized by a mature oak-hickory forest and a state-of-the-art 'Schramm Education Center' that features a large aquarium of native Nebraska fish. The wooded environment is a haven for migratory songbirds and woodpeckers. Because of the limestone outcroppings, the park also features unique ferns and mosses. In the fall, the canopy provides a brilliant display of orange and gold, while the spring brings a carpet of dutchman's breeches and other forest floor wildflowers.","Originally established in 1879 as the Gretna State Fish Hatchery, Schramm is a cornerstone of Nebraska's conservation history. The historic hatch house still stands as a museum, showing how the state first began stocking its waters. Today, it serves as a premier environmental education facility, blending the history of the 19th-century naturalist with 21st-century interactive technology. It is a beloved destination for school groups and families, preserving the cultural legacy of Nebraska's commitment to its aquatic resources. Description is a courtesy of Gemini.",https://lewisandclark.s3.amazonaws.com/wp-content/uploads/2023/04/28175821/SSP80D-0258.jpg
Arbor Park,"North 8th Street, Wymore, Nebraska, 68318",40.1303,-96.6639,0,0,"Southeast Nebraska, Pioneer History, Homestead Site, Railroad History, Small Town Access, Community Gathering, Family Friendly, Dog Friendly, Pet Friendly, Stroller Friendly, Picnic Area, Playground, Local Events, Fourth of July, Agricultural History, Farming Context, Historic Landmark, Bur Oak Forest, Cottonwood Trees, Hardwood Forest, Deciduous Forest, Native Plant Life, Seasonal Wildflowers, Spring Wildflowers, Summer Wildflowers, Autumn Foliage, Songbirds, Meadowlark Sightings, Dickcissel Sightings, Warbler Sightings, Birdwatching, White-Tailed Deer, Raccoon Sightings, Ground Squirrels, Hawk Sightings, Raptor Sightings, Butterfly Garden, Pollinator Habitat, Mixed Grass Prairie, Free Entry, Year Round Access, Parking Available, Restrooms On-Site, Shaded Path, Easy Walk, Short Walk, Peaceful Walk, Photography Point, Nature Photography, Landscape Photography, Wildlife Photography, Quiet Environment, Hidden Gem, Conservation Site, Native Seed Project, Prairie Restoration","Arbor Park is situated in the rolling terrain of southeastern Nebraska near Wymore, a region characterized by gently undulating hills and fertile agricultural land. The park sits at an elevation typical of the transition zone between the Great Plains and the more varied topography of the eastern Nebraska border region. The underlying geology consists of glacial deposits and loess soils that were laid down during the Pleistocene era, creating the rich, deep soils that define this agricultural heartland. The landscape features modest elevation changes with shallow drainage patterns that feed into nearby creek systems. The terrain reflects the characteristic qualities of Southeast Nebraska, where prairie grasslands once dominated before agricultural conversion. Clay and silt soils predominate, with occasional sandy deposits along historical water courses. The park area represents a typical small-town green space carved from the surrounding farmland, maintaining a flat to gently rolling topography that makes it easily accessible and suitable for recreational activities.","The natural environment of Arbor Park reflects the mixed grass prairie ecosystem historically native to southeastern Nebraska, though much of the surrounding landscape has been converted to agricultural use. The park likely features a combination of planted ornamental trees and native species including bur oak, cottonwood, and various hardwood species common to the region. Understory vegetation may include native grasses, wildflowers, and seasonal blooms that attract pollinators such as butterflies, bees, and hummingbirds during warmer months. Wildlife sightings in the area typically include white-tailed deer, eastern cottontail rabbits, ground squirrels, and common raccoons. Birdwatching opportunities abound with songbirds including meadowlarks, dickcissels, and various warbler species during migration periods. Red-tailed hawks and other raptors hunt the surrounding agricultural fields. The park provides habitat for common urban and edge species, serving as a small oasis of green space within the developed town environment. Seasonal wildflowers bring color to the landscape, and autumn foliage provides visual interest as deciduous trees change with the seasons.","Wymore, established in the 1880s during the railroad expansion era, represents typical small-town Nebraska pioneer history and agricultural heritage. Arbor Park's name likely honors Nebraska's deep connection to tree planting and conservation, inspired by J. Sterling Morton who founded Arbor Day in Nebraska City in 1872. The park serves as a community gathering space for local residents, hosting seasonal events, family picnics, and small-town celebrations that are central to rural Nebraska culture. The area around Wymore was settled by homesteaders who transformed the prairie into productive farmland, and the town grew as a railroad stop serving the agricultural economy. The park represents the Nebraska tradition of creating public green spaces even in small communities, reflecting values of conservation, community, and quality of life. Local events and Fourth of July celebrations often center around such parks, maintaining traditions of civic pride and neighborly connection. The park embodies the homestead legacy and continues to serve as a focal point for community life in this southeastern Nebraska farming town.",
Arnold Park,"B Street, Schuyler, Nebraska, 68661",41.4501,-97.0574,0,0,"Central Nebraska, Platte River Valley, Community Gathering, Small Town Access, Family Friendly, Dog Friendly, Pet Friendly, Picnic Area, Playground, Open Space, Local Events, Agricultural History, Farming Context, Pioneer History, Homestead Site, Loess Hills, Deciduous Forest, Bur Oak Forest, Cottonwood Trees, Native Plant Life, Seasonal Wildflowers, Summer Wildflowers, Coneflowers, Sunflower Sightings, Prairie Grass, Songbirds, Meadowlark Sightings, White-Tailed Deer, Raccoon Sightings, Wildlife Sightings, Birdwatching, Red Fox, Ground Squirrels, Butterfly Garden, Pollinator Habitat, Flat Path, Short Walk, Easy Walk, Peaceful Walk, Stroller Friendly, Year Round Access, Free Entry, Parking Available, Restrooms On-Site, Shaded Path, Photography Point, Nature Photography, Spring Blooms, Autumn Foliage, Community Gathering, Southeast Nebraska","Arnold Park is situated in the Platte River Valley region of east-central Nebraska, within the town of Schuyler in Colfax County. The park rests on the relatively flat topography characteristic of the Central Nebraska landscape, with gentle terrain shaped by ancient glacial deposits and centuries of prairie formation. The underlying geology consists primarily of loess soils deposited by wind during the Pleistocene era, creating fertile ground that has supported both native grasslands and agricultural development. The park's elevation is modest, typical of the Platte Valley lowlands, with minimal elevation change throughout the grounds. The landscape reflects the transition zone between the tallgrass prairies to the east and the mixed-grass prairies to the west. Seasonal water patterns from spring rains and snowmelt can influence the park's lower lying areas, though drainage systems help manage moisture levels throughout the year.","Arnold Park supports a variety of native and naturalized plant species typical of the eastern Nebraska prairie ecosystem. The vegetation includes scattered deciduous trees such as cottonwoods, bur oaks, and ash trees that provide shade and habitat for local wildlife. The understory features native and ornamental grasses, seasonal wildflowers including coneflowers and sunflowers during summer months, and various shrubs. Wildlife sightings commonly include songbirds such as meadowlarks and robins, along with occasional visits from red foxes, raccoons, and white-tailed deer that roam through the park during early morning or evening hours. The area serves as habitat for ground squirrels and provides stopover opportunities for migratory birds traveling the Central Flyway. Insect populations include butterflies, dragonflies, and various pollinators that visit flowering plants throughout the growing season. The park's ecosystem reflects the agricultural context of the surrounding landscape while maintaining pockets of natural habitat.","Arnold Park serves as a community gathering space for the residents of Schuyler, a town with deep agricultural and immigrant heritage roots. Schuyler's history reflects the broader pattern of European settlement in Nebraska during the late 19th century, with railroad development spurring town growth and agricultural prosperity. The park functions as a focal point for local recreation, family gatherings, and community events that strengthen social bonds in this small Nebraska town. Over the decades, the park has witnessed the evolution of Schuyler from a primarily agricultural community to one with diverse economic activities including meat processing and manufacturing. The park embodies the small-town Nebraska values of community connection, outdoor recreation, and family-oriented activities. Local residents utilize the space for picnics, youth sports, casual walks, and seasonal celebrations that mark the rhythm of rural Nebraska life. The park represents the ongoing commitment of small-town Nebraska communities to maintain quality public spaces for current and future generations.",
Bell Park,"Derby Street, Bellwood, Nebraska, 68624",41.3392,-97.2406,0,0,"Family Friendly, Community Gathering, Small Town Access, Platte River Valley, Central Nebraska, Eastern Nebraska, Tallgrass Prairie, Mixed Grass Prairie, Prairie Grass, Big Bluestem, Switchgrass, Native Plant Life, Seasonal Wildflowers, Spring Wildflowers, Summer Wildflowers, Coneflowers, Sunflower Sightings, Prairie Sunflowers, Goldenrod, Cottonwood Trees, Willow Trees, Bur Oak Forest, Wildlife Sightings, Birdwatching, Songbirds, Meadowlark Sightings, Warbler Sightings, White-Tailed Deer, Raccoon Sightings, Ground Squirrels, Picnic Area, Dog Friendly, Pet Friendly, Stroller Friendly, Playground, Open Space, Easy Walk, Short Walk, Peaceful Walk, Free Entry, Free Parking, Year Round Access, Farming Context, Agricultural History, Pioneer History, Local Events, Summer Festival, Fourth of July, Quiet Environment, Hidden Gem, Prairie Education, Conservation Education, Community Gathering, Shaded Path","Bell Park is situated in the eastern Nebraska landscape near Bellwood, a small community in Butler County. The terrain reflects the characteristic features of the Platte River Valley region, with gently rolling topography shaped by glacial deposits and centuries of river activity. The park sits on relatively flat to slightly undulating ground, typical of the agricultural plains that dominate this part of Nebraska. The underlying geology consists of deep loess soils deposited by wind during the Pleistocene epoch, overlaying glacial till and older sedimentary formations. The area's elevation is modest, placing it within the transition zone between the tallgrass prairie ecosystem to the east and mixed-grass prairie to the west. Seasonal water patterns influence the local landscape, with occasional low-lying areas that collect moisture during spring rains and snowmelt. The soil composition is primarily composed of fertile silty loam, which has made the surrounding region excellent for agricultural production. Bell Park represents a small green space within the broader context of Nebraska's intensively farmed landscape.","The natural environment of Bell Park near Bellwood features elements characteristic of eastern Nebraska's prairie ecosystem, though modified by human activity and community development. Native plant species that may be present include remnants of tallgrass prairie vegetation such as big bluestem, switchgrass, and various native wildflowers that bloom seasonally from spring through fall. Common wildlife in this region includes white-tailed deer, which frequent small community parks, and numerous bird species including meadowlarks, whose distinctive songs characterize Nebraska's grasslands. Songbirds such as robins, cardinals, and various warblers utilize the area during migration and breeding seasons. Small mammals like cottontail rabbits, ground squirrels, and occasionally raccoons inhabit the vicinity. The park likely contains planted trees including cottonwoods, willows, or bur oaks, providing shade and habitat. During spring and summer, wildflowers such as coneflowers, sunflowers, and goldenrod may add color to the landscape. The ecosystem represents a human-managed green space within an agricultural matrix, providing important habitat corridors for wildlife moving through the intensively farmed region of Butler County.","Bell Park serves as a community gathering space for the small village of Bellwood, which was established in the late 19th century as Nebraska experienced its great wave of settlement and agricultural development. Butler County, where Bellwood is located, was organized in 1868 and attracted primarily Czech and German immigrants who established farming communities throughout the region. The park reflects the Nebraska tradition of small-town community spaces that serve as focal points for local recreation, social gatherings, and civic events. These community parks became especially important in rural Nebraska towns during the early 20th century as centers for Fourth of July celebrations, community picnics, and local festivals. The park's location near Derby Street places it within the modest grid of streets that characterize small Nebraska agricultural towns. Like many rural Nebraska communities, Bellwood has experienced demographic changes over the decades, but community parks remain important symbols of local identity and gathering places. The park represents the enduring Nebraska value of maintaining public spaces for recreation and community connection, even in small villages where resources may be limited. It embodies the prairie state's commitment to preserving quality of life in rural communities.",https://upload.wikimedia.org/wikipedia/commons/thumb/6/66/Bellpark_1863.jpg/800px-Bellpark_1863.jpg
Buffalo Square,"6th Street, Columbus, Nebraska, 68601",41.4217,-97.3467,0,0,"Historic Landmark, Pioneer History, Central Nebraska, Platte River Valley, Small Town Access, Community Gathering, Local Events, Family Friendly, Stroller Friendly, Dog Friendly, Pet Friendly, Free Entry, Year Round Access, Open Space, Shaded Path, Paved Path, Wheelchair Accessible, Accessible Trail, Easy Walk, Short Walk, Peaceful Walk, Photography Point, Birdwatching, Songbirds, Squirrel Sightings, Deciduous Forest, Cottonwood Trees, Autumn Foliage, Spring Blooms, Seasonal Wildflowers, Butterfly Garden, Pollinator Habitat, Monarch Butterfly Migration, Picnic Area, Free Parking, Parking Available, Restrooms On-Site, Drinking Water, Public Square, Urban Park, Town Square, Gathering Place, Fourth of July, Summer Festival, Ice Age Remnant, Loess Hills","Buffalo Square is located in the heart of Columbus, Nebraska, situated in the Platte River Valley of Central Nebraska. The area rests on deep deposits of loess soil and glacial till, characteristic of the region's Ice Age history. The terrain is remarkably flat, typical of the Central Plains topography, with minimal elevation changes throughout the square and surrounding blocks. The underlying geology consists of sedimentary layers deposited over millennia by the ancestral Platte River system. The landscape has been entirely modified by urban development, with the natural prairie converted to city streets, buildings, and manicured lawns. The soil beneath remains rich and fertile, composed of wind-deposited loess that gives the region its agricultural productivity. Drainage patterns have been altered through municipal infrastructure, directing water toward storm sewers rather than natural waterways. The square sits approximately 1,450 feet above sea level in the broad, flat expanse of the Platte River Valley.","As an urban square in downtown Columbus, Buffalo Square features predominantly landscaped vegetation rather than native ecosystems. Ornamental trees such as maples, ash, and possibly bur oaks provide shade and seasonal interest, with spring blooms and autumn foliage marking the changing seasons. Maintained lawns of non-native grass species cover much of the ground, requiring regular irrigation and maintenance. Flowerbeds may contain seasonal plantings including petunias, marigolds, and other ornamental species. Urban wildlife adapts to this environment, with common sightings including eastern gray squirrels, fox squirrels, American robins, house sparrows, European starlings, and mourning doves. During migration seasons, various songbirds may pause in the square's trees. Rock pigeons frequent the area, and at night, raccoons may visit. Insects include honeybees, bumblebees visiting flowers, butterflies during warmer months including monarchs during migration, and various urban-adapted species. The square functions as a small green space within the urban ecosystem, providing limited habitat but serving as a respite from surrounding pavement.","Buffalo Square serves as a central gathering place in Columbus, Nebraska, a city founded in 1856 along the historic Overland Trail route. The square reflects the traditional Midwestern town plaza concept, where civic life and community gatherings have centered for generations. Columbus developed as an important agricultural trade center and county seat of Platte County, with Buffalo Square witnessing the city's growth from frontier settlement to modern community. The square likely hosts community events, farmers markets, holiday celebrations, and serves as a focal point for civic activities. Downtown Columbus retains historic architecture surrounding the square, with buildings dating from the late 19th and early 20th centuries reflecting the city's commercial heritage. The area represents the enduring importance of public gathering spaces in Nebraska's small cities, where residents connect with their community and celebrate local traditions. The square's name honors the American bison that once roamed Nebraska's prairies before settlement, connecting modern residents to the region's natural heritage and the dramatic transformation that occurred during pioneer settlement.",
Community Park,"Colfax Street, Schuyler, Nebraska, 68661",41.4358,-97.0609,0,0,"Central Nebraska, Platte River Valley, Community Gathering, Small Town Access, Family Friendly, Dog Friendly, Pet Friendly, Playground, Picnic Area, Picnic Shelters, Open Space, Flat Path, Paved Trail, Stroller Friendly, Easy Walk, Accessible Trail, Mixed Grass Prairie, Prairie Grass, Cottonwood Trees, Deciduous Forest, Native Plant Life, Seasonal Wildflowers, Spring Wildflowers, Summer Wildflowers, Birdwatching, Songbirds, Meadowlark Sightings, Warbler Sightings, White-Tailed Deer, Coyote Sightings, Raccoon Sightings, Ground Squirrels, Jackrabbits, Pollinator Habitat, Butterfly Garden, Monarch Butterfly Migration, Tick Habitat, Mosquito Season, Clay Soil, Pioneer History, Agricultural History, Farming Context, Homestead Site, Local Events, Summer Festival, Fourth of July, Free Entry, Free Parking, Parking Available, Restrooms On-Site, Drinking Water, Grills Available, Year Round Access, Shaded Path, Photography Point, Nature Photography, Peaceful Walk, Short Walk, Wildlife Sightings, High Plains Climate, No Shade, Minimal Shade, Popular Destination, Leash Required","Community Park in Schuyler, Nebraska is situated in the Platte River Valley of Colfax County, within the Central Nebraska region. The terrain is characterized by flat to gently rolling topography typical of the Great Plains, with relatively low elevation and minimal elevation gain. The landscape reflects the geological history of glacial deposits and loess accumulation that shaped this part of Nebraska over millennia. The underlying geology consists primarily of clay soil and sedimentary layers deposited by ancient river systems. The park area exhibits the classic flat path terrain of eastern Nebraska's agricultural belt, with open space that provides panoramic views of the surrounding farmland. The Platte River Valley's influence is evident in the floodplain characteristics, though the park itself sits on slightly elevated ground to avoid flooding. This central Nebraska location experiences the typical High Plains climate with its continental weather patterns.","The natural environment of Community Park features elements of the mixed grass prairie ecosystem that once dominated this region, though much has been modified for community use. Native plant life includes remnants of big bluestem and other prairie grasses along park edges, with seasonal wildflowers appearing in spring and summer months. Cottonwood trees and deciduous forest elements provide shade throughout the park, creating habitat corridors for local wildlife. Birdwatching opportunities include sightings of meadowlarks, songbirds, and various warbler sightings during migration seasons. The park serves as a pollinator habitat with butterfly gardens attracting monarch butterfly migration participants. White-tailed deer occasionally visit from surrounding agricultural areas, and coyote sightings occur in early morning or evening hours. Aquatic plants may be present if water features exist. The ecosystem supports common Nebraska wildlife including raccoon sightings, ground squirrels, and jackrabbits. Tick habitat and mosquito season considerations are typical for this region during warmer months.","Community Park serves as an important gathering place for the Schuyler community, reflecting the town's agricultural history and German-American heritage dating back to pioneer settlement in the 1860s. The park represents the evolution of small town Nebraska from frontier homestead sites to established agricultural communities. Schuyler's location along historic transportation routes contributed to its development as a regional center. The park functions as a community gathering space for local events, providing a venue for summer festivals and Fourth of July celebrations that maintain traditions of rural Nebraska towns. The cultural significance lies in its role as public open space in a farming community, offering families and residents a place for recreation and social connection. The park embodies the values of community investment in public spaces typical of Nebraska small towns, where such areas serve multiple generations. It reflects ranching history and farming context of the surrounding Colfax County agricultural landscape, while providing modern recreational opportunities that balance preservation of community character with contemporary needs.",https://upload.wikimedia.org/wikipedia/commons/thumb/c/c3/St._Catharines_Stompers_vs_Vermont_Expos_at_Community_Park_-_August_1995.jpg/800px-St._Catharines_Stompers_vs_Vermont_Expos_at_Community_Park_-_August_1995.jpg
