name,address,latitude,longitude,difficulty,satisfaction,tags,description_geography,description_nature,description_culture,image
Holsten Park Fields,"Trailer Court Road, Dodge, Nebraska, 68633",41.7233,-96.8759,0,0,"Central Nebraska, Platte River Valley, Southeast Nebraska, Eastern Nebraska, Tallgrass Prairie, Prairie Grass, Big Bluestem, Switchgrass, Native Plant Life, Seasonal Wildflowers, Summer Wildflowers, Sunflower Sightings, Prairie Sunflowers, Coneflowers, Goldenrod, Cottonwood Trees, Bur Oak Forest, White-Tailed Deer, Meadowlark Sightings, Dickcissel Sightings, Hawk Sightings, Songbirds, Birdwatching, Wildlife Sightings, Raccoon Sightings, Ground Squirrels, Family Friendly, Dog Friendly, Pet Friendly, Playground, Picnic Area, Open Space, Flat Path, Easy Walk, Short Walk, Stroller Friendly, Community Gathering, Small Town Access, Agricultural History, Farming Context, Year Round Access, Free Entry, Parking Available, Local Events, Peaceful Walk, Photography Point, Nature Photography, Landscape Photography, Wildlife Photography, Spring Blooms, Autumn Foliage, Sunny Exposure, Wind Exposure, High Plains Climate, Humid Climate, Tick Habitat, Mosquito Season, Sun Protection Required, Water Required, Quiet Environment, Hidden Gem, Leash Required, Prairie Education, Environmental Education, Conservation Education, Leave No Trace","Holsten Park Fields is situated in the gently rolling terrain characteristic of Dodge County in east-central Nebraska, part of the broader Platte River Valley region. The landscape features relatively flat to slightly undulating topography shaped by glacial deposits and loess accumulation from ancient wind-driven sediment. The area sits on deep, fertile soils typical of the Central Nebraska plains, composed primarily of silty loam and clay materials deposited over millennia. The terrain exhibits minimal elevation change, creating expansive open spaces ideal for recreational fields and community gatherings. Nearby Trailer Court Road provides access through agricultural land that has been modified from its original tallgrass prairie ecosystem. The geology beneath consists of Quaternary sediments overlying older Cretaceous and Tertiary formations, with groundwater resources relatively accessible due to the proximity to the Platte River watershed system that has shaped this region's subsurface hydrology.","The ecological context of Holsten Park Fields reflects a highly modified landscape where native tallgrass prairie has been largely converted to managed recreational space and surrounding agricultural use. Remnant native plant species may persist along field margins, including big bluestem, switchgrass, and various prairie forbs that emerge seasonally. The area provides habitat for adaptable wildlife species common to eastern Nebraska's agricultural matrix, including white-tailed deer that forage during dawn and dusk hours, and various songbirds such as meadowlarks and dickcissels during breeding season. Red-tailed hawks and American kestrels hunt over open spaces, while eastern cottontail rabbits and thirteen-lined ground squirrels inhabit field edges. Seasonal wildflowers including sunflowers, coneflowers, and goldenrod may bloom in unmowed areas during summer months. The site experiences typical eastern Nebraska weather patterns with humid continental climate influences, supporting deciduous tree plantings and maintained turf grass. Occasional cottonwood and bur oak trees provide limited shade and nesting sites for cavity-nesting birds.","Holsten Park Fields serves as a community recreational hub in Dodge, Nebraska, a small town embodying the agricultural heritage and tight-knit social fabric typical of rural Nebraska communities. The park facilities reflect the importance of youth sports, family gatherings, and outdoor recreation in Great Plains small-town culture, where public parks function as central gathering spaces for community events, summer sports leagues, and local celebrations. Dodge County's broader history connects to homesteading era settlement patterns beginning in the 1860s and 1870s, when European immigrant families, particularly of German and Czech descent, established farms across this fertile landscape. The area's agricultural legacy continues to shape local identity, with farming and ranching remaining economically and culturally significant. Community parks like Holsten Park Fields represent investments in quality of life and youth development that help sustain small-town vitality. The location near residential areas indicates its role in neighborhood recreation and informal daily use, reflecting values of accessible public space and community connection that characterize Nebraska's rural towns.",
Lincoln Park,"Road 3500, Superior, Nebraska, 68978",40.0206,-98.0828,0,0,"Central Nebraska, Republican River Valley, Mixed Grass Prairie, Prairie Grass, Native Plant Life, Seasonal Wildflowers, Sunflower Sightings, Coneflowers, Goldenrod, Big Bluestem, Switchgrass, Buffalo Grass, Cottonwood Trees, Wildlife Sightings, Birdwatching, Meadowlark Sightings, White-Tailed Deer, Hawk Sightings, Raptor Sightings, Songbirds, Pheasant Sightings, Family Friendly, Community Gathering, Small Town Access, Pioneer History, Homestead Site, Agricultural History, Farming Context, Ranching History, Picnic Area, Open Space, Quiet Environment, Photography Point, Nature Photography, Landscape Photography, Peaceful Walk, Easy Walk, Short Walk, Southeast Nebraska, High Plains, Tallgrass Prairie, Shortgrass Prairie, Pollinator Habitat, Butterfly Garden, Stroller Friendly, Dog Friendly, Pet Friendly, Local Events, Summer Festival, Free Entry, Year Round Access, Parking Available, Prairie Education, Conservation Education, Wildlife Photography, Hidden Gem","Lincoln Park near Superior, Nebraska sits within the Republican River Valley region of south-central Nebraska, characterized by the gently rolling terrain typical of the Central Great Plains. The landscape features relatively flat to moderately undulating topography shaped by thousands of years of wind and water erosion. The underlying geology consists primarily of Quaternary sediments including loess deposits and alluvial materials that have accumulated over ancient bedrock. The soil composition is predominantly silty clay loam with excellent agricultural potential, reflecting the rich glacial till and windblown sediments that define this portion of the Central Lowlands physiographic province. The park area sits at a modest elevation typical of the Republican River drainage basin, with minimal elevation change but subtle terrain variations that provide natural drainage patterns. The local topography reflects the transition zone between the High Plains to the west and the lower elevation prairie lands to the east, creating a distinctive landscape character marked by open spaces and long sight lines across agricultural lands.","The natural ecosystem surrounding Lincoln Park represents typical mixed-grass prairie habitat that once dominated south-central Nebraska. Native vegetation includes a combination of big bluestem, little bluestem, buffalo grass, and switchgrass species that have adapted to the semi-arid continental climate. Seasonal wildflowers add color throughout the growing season, with coneflowers, sunflowers, and goldenrod providing important nectar sources for pollinators. The area supports diverse wildlife populations including white-tailed deer that browse along field edges and shelterbelts. Birdwatching opportunities abound with meadowlark sightings common, along with various songbird species, red-tailed hawks, and other raptors hunting over open fields. During spring and fall, migrating waterfowl may utilize nearby wetland areas and the Republican River corridor. Small mammal populations including cottontail rabbits, ground squirrels, and prairie voles provide prey base for predators. Pheasant populations thrive in the agricultural landscape mosaic. Cottonwood trees may line nearby waterways, while planted shelterbelts of deciduous trees provide wildlife cover and nesting habitat in this predominantly agricultural landscape.","Superior, established in 1879, developed as an agricultural center in Nuckolls County during Nebraska's homesteading era. The area's cultural history reflects the pioneer spirit of settlers who transformed native prairie into productive farmland under the Homestead Act. Lincoln Park likely serves as a community gathering space maintaining the strong tradition of small-town Nebraska social life where local events, celebrations, and recreational activities bring residents together. The park name itself honors President Abraham Lincoln, reflecting the common practice of naming civic spaces after national figures during Nebraska's territorial and early statehood period. The surrounding agricultural landscape tells the ongoing story of family farming and ranching that has sustained rural Nebraska communities for generations. Road 3500 follows the grid pattern established by the Public Land Survey System, which organized western territories into the orderly township and range system still evident today. The park represents the Nebraska values of community investment in public spaces for family recreation and quality of life. Local agricultural heritage includes generations of wheat, corn, and soybean production, along with cattle ranching operations that continue to define the regional economy and culture.",https://upload.wikimedia.org/wikipedia/commons/thumb/7/73/Full_chicago_skyline.jpg/800px-Full_chicago_skyline.jpg
Loup Park,"Lakeview Lane, Nebraska, 68601",41.4947,-97.3709,0,0,"Central Nebraska, Loup River Valley, Mixed Grass Prairie, Cottonwood Trees, Willow Trees, Bur Oak Forest, Deciduous Forest, White-Tailed Deer, Meadowlark Sightings, Songbirds, Raptor Sightings, Hawk Sightings, Birdwatching, Wildlife Sightings, Raccoon Sightings, Ground Squirrels, Seasonal Wildflowers, Spring Wildflowers, Summer Wildflowers, Native Plant Life, Big Bluestem, Switchgrass, Prairie Grass, Riparian Zone, Butterfly Garden, Dragonfly Sightings, Family Friendly, Dog Friendly, Pet Friendly, Picnic Area, Playground, Community Gathering, Local Events, Small Town Access, Stroller Friendly, Easy Walk, Peaceful Walk, Short Walk, Nature Photography, Wildlife Photography, Photography Point, Flat Path, Paved Path, Free Entry, Free Parking, Parking Available, Year Round Access, Restrooms On-Site, Drinking Water, Shaded Path","Loup Park is situated in the Loup River Valley of central Nebraska near Columbus, positioned within the distinctive transition zone between the Great Plains and the more rolling terrain characteristic of eastern Nebraska. The landscape features gentle undulations with relatively flat to moderately sloping topography typical of the Platte River watershed region. The soil composition consists primarily of loamy alluvial deposits mixed with sandy substrates, a legacy of ancient river meanders and glacial outwash from the Pleistocene epoch. The terrain exhibits classic river valley characteristics with subtle elevation changes, occasional sandy patches, and well-drained uplands that transition into moister lowland areas. The park's geography reflects the broader Loup River Valley ecosystem, where the land gently slopes toward the drainage systems that feed into the larger Platte River network, creating a mosaic of microhabitats shaped by water movement and sediment deposition over millennia.","The natural environment of Loup Park showcases a mixed-grass prairie ecosystem interspersed with deciduous woodland elements typical of eastern Nebraska's transitional ecological zone. Native vegetation includes big bluestem, switchgrass, and various prairie forbs that create seasonal displays of wildflowers from spring through autumn. Cottonwood and willow trees establish themselves along drainage corridors, while scattered bur oaks represent the hardwood forest components. The park provides habitat for white-tailed deer, which are frequently observed during dawn and dusk hours, along with abundant small mammal populations including raccoons and ground squirrels. Birdwatching opportunities include sightings of meadowlarks, various songbird species, and occasional raptor activity with red-tailed hawks hunting the open areas. Seasonal waterfowl utilize nearby water features during migration periods. The riparian zones support diverse insect populations, particularly butterflies and dragonflies during warmer months, while the prairie areas host grassland-adapted species that contribute to the park's ecological diversity and provide opportunities for nature observation throughout the year.","Loup Park serves as a community gathering space for Columbus and the surrounding Platte County area, reflecting Nebraska's tradition of establishing municipal parks for recreation and social connection in the early-to-mid 20th century. The park's location near the Loup River Valley connects it to the broader historical significance of Nebraska's river systems, which served as vital corridors for Native American peoples, particularly the Pawnee and other Plains tribes, long before European settlement. The agricultural heritage of the region is evident in the surrounding landscape, where generations of farming families have shaped the land since homesteading began in the 1860s. The park represents the community's commitment to preserving green spaces within an agricultural context, providing residents with accessible outdoor recreation close to home. Local events and family gatherings have made the park an integral part of Columbus's social fabric, continuing Nebraska's tradition of community-centered outdoor spaces that bring together diverse groups for relaxation, play, and celebration throughout the changing seasons.",
Memorial Park,"South 33rd Street, Lincoln, Nebraska, 68506",40.7828,-96.6731,0,0,"State Park,Family Friendly,Dog Friendly,Pet Friendly,Leash Required,Playground,Picnic Area,Picnic Shelters,Grills Available,Paved Trail,Accessible Trail,Wheelchair Accessible,Stroller Friendly,Short Walk,Easy Walk,Peaceful Walk,Flat Path,Birdwatching,Songbirds,Wildlife Sightings,White-Tailed Deer,Raccoon Sightings,Ground Squirrels,Native Plant Life,Seasonal Wildflowers,Spring Wildflowers,Summer Wildflowers,Coneflowers,Sunflower Sightings,Bur Oak Forest,Cottonwood Trees,Deciduous Forest,Autumn Foliage,Spring Blooms,Butterfly Garden,Pollinator Habitat,Monarch Butterfly Migration,Urban Park,Community Gathering,Local Events,Photography Point,Nature Photography,Landscape Photography,Restrooms On-Site,Drinking Water,Parking Available,Free Parking,Paved Parking Lot,Free Entry,Year Round Access,Open Space,Shaded Path,Cell Coverage Good,Southeast Nebraska,Platte River Valley,Conservation Education,Environmental Education,Service Animals Welcome,Pet Waste Stations,Trash Cans","Memorial Park is situated in the gently rolling terrain characteristic of the Platte River Valley in southeastern Nebraska. The park's landscape reflects the glacial history of the region, with relatively flat to gently undulating topography shaped by ancient ice sheets and subsequent erosion. The underlying geology consists of glacial till deposits overlaying sedimentary bedrock typical of the Great Plains. The soil composition is predominantly loess, wind-deposited silt that creates the rich, fertile ground common to Lancaster County. The park sits at an elevation typical of Lincoln's eastern neighborhoods, with minimal elevation changes throughout its grounds. The terrain features typical urban park landscaping integrated with remnant prairie topography, representing the transition zone between the tallgrass prairie ecosystem and developed urban environment. Drainage patterns within the park flow generally eastward, following the natural gradient toward Salt Creek and ultimately the Platte River system.","Memorial Park supports a mix of maintained urban greenspace and naturalized areas featuring native and introduced plant species. The tree canopy includes mature specimens of bur oak, eastern cottonwood, American elm, and various planted ornamental species that provide habitat for urban-adapted wildlife. The understory vegetation includes Kentucky bluegrass and some remnant native grasses where prairie restoration efforts have been implemented. Seasonal wildflowers appear in maintained beds and naturalized areas, with spring blooms of tulips and daffodils transitioning to summer displays of coneflowers and black-eyed susans. The park attracts a diverse array of songbirds including American robins, northern cardinals, house finches, and various warbler species during migration. Eastern fox squirrels and eastern cottontail rabbits are common mammalian residents. White-tailed deer occasionally visit during early morning or evening hours. The park serves as an important urban wildlife corridor, supporting populations of monarch butterflies during migration season and providing pollinator habitat through native plantings.","Memorial Park serves as an important community gathering space in Lincoln's established south-central neighborhoods, reflecting the city's commitment to accessible public recreation areas developed throughout the mid-20th century. The park's name commemorates local veterans and community members, continuing Lincoln's tradition of honoring civic service through public spaces. As part of Lincoln's extensive parks system, Memorial Park has served generations of families as a venue for community celebrations, youth sports, family picnics, and neighborhood events. The park embodies the prairie state's cultural values of community connection and outdoor recreation, providing a green oasis within the urban fabric. Its location near South 33rd Street places it along one of Lincoln's major north-south corridors, making it readily accessible to diverse populations. The park reflects Lincoln's ongoing commitment to urban forestry, recreational programming, and maintaining quality of life through public green spaces. It continues to serve as an important neighborhood anchor, fostering community bonds and providing respite from urban density while maintaining connections to Nebraska's natural heritage.",
Memorial Park,"East Military Avenue, Fremont, Nebraska, 68025",41.4361,-96.4759,0,0,"Pioneer History, Military History, Frontier History, Eastern Nebraska, Platte River Valley, Elkhorn River Valley, Hardwood Forest, Deciduous Forest, Bur Oak Forest, Cottonwood Trees, Willow Trees, Native Plant Life, Seasonal Wildflowers, Wildlife Sightings, Birdwatching, Songbirds, Warbler Sightings, Meadowlark Sightings, White-Tailed Deer, Raccoon Sightings, Ground Squirrels, Frog and Toad Habitat, Paved Trail, Flat Path, Accessible Trail, Wheelchair Accessible, Stroller Friendly, Family Friendly, Dog Friendly, Pet Friendly, Playground, Picnic Area, Picnic Shelters, Restrooms On-Site, Drinking Water, Parking Available, Free Parking, Paved Parking Lot, Free Entry, Year Round Access, Open Space, Shaded Path, Community Gathering, Local Events, Summer Festival, Fourth of July, Easy Walk, Short Walk, Peaceful Walk, Small Town Access, Loess Hills","Memorial Park in Fremont, Nebraska is situated in the Platte River Valley of eastern Nebraska, characterized by relatively flat terrain typical of the Elkhorn River Valley region. The landscape features gently rolling topography shaped by glacial deposits and alluvial processes from nearby waterways. The park sits on rich loess soil, windblown sediment that defines much of eastern Nebraska's fertile terrain. The geology consists of deep layers of fine-grained sediments deposited during the Pleistocene epoch, creating well-drained but moisture-retentive soils. The area's elevation is modest, typical of the Central Lowlands physiographic province. The terrain shows minimal elevation change, making it accessible and easy to traverse. Located in Dodge County near East Military Avenue, the park's landscape reflects centuries of river valley formation and the influence of the Elkhorn River watershed system that has shaped the broader Fremont area's geography and ecological character.","Memorial Park features a diverse ecosystem representative of eastern Nebraska's transitional zone between tallgrass prairie and deciduous forest habitats. The park contains mature hardwood trees including bur oak, cottonwood, and willow trees that provide critical habitat for songbirds, including meadowlarks and various warbler species. Wildlife sightings commonly include white-tailed deer, raccoons, and ground squirrels, while the area serves as important habitat for migratory birds during spring and fall seasons. The understory supports native plant life and seasonal wildflowers that bloom throughout the growing season. The park's green spaces attract birdwatching enthusiasts seeking sightings of robins, cardinals, and various raptor species. Aquatic habitats in nearby areas support frogs and toads, while the park's trees and shrubs provide nesting sites for numerous bird species. The ecosystem benefits from Fremont's position in the Elkhorn River Valley, which creates a riparian-influenced environment supporting diverse flora and fauna typical of eastern Nebraska's mixed habitat zones.","Memorial Park holds significant cultural importance for Fremont, a community with deep pioneer history and frontier heritage dating to the mid-1800s. Fremont was established along important transportation corridors and served as a vital stop for westward expansion. The park serves as a community gathering space honoring the area's military history and veterans, reflecting Nebraska's strong tradition of patriotic commemoration. The location near East Military Avenue underscores the connection to Fremont's military heritage and the broader history of the region's role in American expansion. The park functions as a venue for local events, summer festivals, and Fourth of July celebrations that bring together residents in the tradition of small-town Nebraska community life. As an urban green space, it represents the evolution of Fremont from frontier settlement to modern city while preserving space for recreation and reflection. The park embodies the values of Nebraska communities: honoring service, preserving history, and providing accessible public spaces for family-friendly gatherings and peaceful walks that strengthen community bonds across generations.",
