name,address,latitude,longitude,difficulty,satisfaction,tags,description_geography,description_nature,description_culture,image
Chimney Rock National Historic Site,Chimney Rock Road near Bayard Nebraska,41.7553,-103.3271,48,76,"Old Wagon Ruts,No Trees,Sandy Spots,Snake Hazard,Open Space,Dirt Trail,Gift Shop,Uphill Walk,Telescope On-Site,Prairie Grass,Historic Landmark,Oregon Trail Site,Paved Parking Lot,Visitor Center,Picnic Area,Restrooms On-Site,Wheelchair Accessible Path,Dog Friendly,Panoramic Views,Photography Spot,Fossil History,Native Plant Life,Wind Exposure,Extreme Sun Exposure,Minimal Shade,Wildlife Sightings,Birdwatching,Stargazing Spot,Seasonal Wildflowers,Loose Gravel Path,Short Loop Available,Guided Tours,Educational Signage,Clay Soil,Seasonal Closure Risk,Limited Cell Service,Free Entry,National Park Pass Accepted,Evening Access,Sunrise Views","Rising nearly 300 feet above the surrounding North Platte River Valley, Chimney Rock is a geological marvel composed of layers of Brule clay, volcanic ash, and Arickaree sandstone. This iconic spire served as a critical milestone for pioneers, signaling the end of the flat prairie and the beginning of the rugged mountain terrain. Today, the formation continues to stand as a dramatic silhouette against the Nebraska sky, though natural erosion slowly reshapes its famous profile year by year.","The area surrounding the rock is a vibrant example of the short-grass prairie ecosystem. Hikers may spot pronghorn antelope darting through the brush or hear the distinct call of the Western Meadowlark. The vegetation is hardy and adapted to the arid climate, featuring buffalo grass, prickly pear cactus, and yucca plants. During the spring, the landscape is dotted with wildflowers like prairie sunflowers, providing a stark, beautiful contrast to the sun-baked earth of the spire.","Chimney Rock holds the title of the most frequently mentioned landmark in the diaries of over 500,000 pioneers who traveled the Oregon, California, and Mormon Trails. For these travelers, it was a beacon of progress and a symbol of endurance. Long before the settlers, Native American tribes recognized the spire as a spiritual site and a guidepost. It was designated a National Historic Site in 1956, preserving its legacy as one of the most significant symbols of the American West. Description is a courtesy of Gemini.",https://visitnebraska.com/sites/default/files/listing_images/profile/3399/ChimneyRock_709_10jpg1488325619.jpg
Cowboy Trail,1000 S 13th St Norfolk NE 68701,41.9833,-97.4167,35,82,"Long Distance Trail,Rail Trail,Crushed Limestone,Dirt Trail,Biking Friendly,Horseback Riding,Dog Friendly,Open Space,Wildlife Sightings,Birdwatching,Sandhills Region,River Crossings,High Trestle Bridges,Photography Spot,Historic Rail History,Cows On-Site,Flat Path,Minimal Shade,Wind Exposure,Extreme Sun Exposure,Camping Nearby,Small Town Access,Biking Repair Stations,Picnic Area,Niobrara River Views,Sunset Views,Goldenrod,Sunflower Sightings,Wild Turkeys,Deer Sightings,Minimal Cell Service,Water Crossings,Gravel Path,Multi-Day Trek,Public Land,Nature Observation,Quiet Environment,Prairie Landscapes,Elkhorn River Trail,History Markers","Spanning 321 miles across northern Nebraska, the Cowboy Trail is a premier rails-to-trails project following the historic Chicago and North Western railway corridor. The path transitions from the lush Elkhorn River Valley into the rolling, ancient dunes of the Sandhills, characterized by a surface of crushed limestone and dirt. Its geographical crown jewel is the Valentine Bridge, a massive trestle standing 148 feet above the Niobrara River, offering a panoramic view of the rugged river breaks and the vast Great Plains below.","The trail corridor serves as a vital sanctuary for the 'sea of grass' ecosystem, featuring tallgrass species like big bluestem and switchgrass. Travelers frequently encounter diverse wildlife, including white-tailed deer leaping through the brush, wild turkeys, and red-tailed hawks circling overhead. In the spring and summer, the path is lined with native goldenrod and sunflowers, providing a vibrant floral border against the wide-open prairie. The quiet nature of the trail makes it a premier destination for birdwatching and observing the reclaiming of the iron horse's path by the natural world.","Originally known as the 'Cowboy Line,' this trail represents a piece of living rural Americana, connecting small Nebraska towns that once thrived on the railroad's pulse. Modern explorers can visit historic depots and local diners that serve as critical rest stops, much like the water stops for steam engines in the 19th century. The trail symbolizes the enduring spirit of the West, where the roar of the locomotive has been replaced by the quiet footsteps of hikers and cyclists. It stands today as the longest rail trail in the state, preserving the legacy of the Nebraska frontier for future generations. Description is a courtesy of Gemini.",https://visitnebraska.com/sites/default/files/2019-01/cowboy_trail_valentine01_dsmith.jpg
Scotts Bluff National Monument,190276 Old Oregon Trail Gering NE 69341,41.8385,-103.7088,65,88,"Historic Landmark,Oregon Trail Site,Paved Trail,Uphill Walk,Extreme Sun Exposure,Minimal Shade,Wind Exposure,Photography Spot,National Park Pass Accepted,Visitor Center,Restrooms On-Site,Picnic Area,Wheelchair Accessible Path,Geological Marvel,Clay Soil,Sandstone Bluffs,Prairie Grass,Native Plant Life,Wildlife Sightings,Birdwatching,Rattlesnake Hazard,Prairie Dogs,Mule Deer,Photography Spot,Sunset Views,Guided Tours,Educational Signage,Tunnel Passage,Panoramic Views,Elevation Gain,Short Loop Available,Biking Prohibited on Trails,Free Parking,Historic Wagons,Museum On-Site,Gift Shop,Stargazing Spot,Accessible Overlooks,Seasonal Wildflowers","Towering 800 feet above the North Platte River, Scotts Bluff National Monument is a geological fortress composed of distinct layers of siltstone, volcanic ash, and sandstone. The monument features five massive outcroppings—including Eagle Rock and Sentinel Rock—sculpted by millions of years of wind and water erosion. The Saddle Rock Trail offers a rigorous climb through a unique pedestrian tunnel carved directly into the bluff, leading to 360-degree panoramic overlooks that reveal the dramatic topography of the Nebraska Panhandle.","This high-plains ecosystem creates a unique habitat where ponderosa pines and Rocky Mountain junipers cling to the rugged cliffsides. Near the base, bustling prairie dog towns provide constant activity, while mule deer frequently graze in the shadowed canyons. Overhead, the thermals created by the bluffs support nesting golden eagles and prairie falcons. The vegetation is a hardy mix of mountain mahogany and aromatic sagebrush, specifically adapted to survive the intense sun and wind exposure common to this high-elevation environment.","Historically known as 'Me-a-pa-te' (the hill that is hard to go around) by the Lakota, Scotts Bluff became a pivotal landmark for over half a million emigrants on the Oregon, California, and Mormon Trails. The site still preserves deep, original wagon ruts carved into the earth by pioneers, serving as a visceral connection to the 19th-century westward expansion. It was designated a National Monument in 1919 to protect its status as a living history museum, featuring a renowned collection of frontier sketches by William Henry Jackson. The bluff remains an enduring symbol of the challenges and perseverance of the American pioneer spirit. Description is a courtesy of Gemini.",https://visitnebraska.com/sites/default/files/listing_images/profile/3500/9209146d086faabbf85006a44137a46c_2017BrianPoffenbergerMitchellPasssunset1.jpg
Carhenge,2151 CR 59 Alliance NE 69301,42.1422,-102.8578,10,85,"Unique Landmark,Art Installation,Roadside Attraction,Flat Path,Photography Spot,Free Entry,Gravel Parking,Gift Shop,Open Space,No Shade,Wind Exposure,Stargazing Spot,Accessible Path,Picnic Area,Restrooms On-Site,Seasonal Wildflowers,Prairie Grass,Native Plant Life,Birdwatching,Fossil History,Educational Signage,Creative Monument,Vintage Cars,Quirky Vibe,Family Friendly,Sunset Views,Sunrise Views,Minimal Cell Service,No Trees,Short Walk,National Geographic Highlight,Cadillac Heel Stone,Slate Gray Paint,Summer Solstice Site,Industrial Art,Modern Megalith,Panhandle Attraction,Outdoor Gallery,Short Loop,Easy Walk","Carhenge is a faithful replica of England's Stonehenge, constructed entirely from vintage American automobiles. Geographically, it sits on the high plains of the Nebraska Panhandle, where the flat, expansive horizon provides a stark backdrop for the 39 vehicles arranged in a 96-foot diameter circle. The 'heel stone' is a 1962 Cadillac, and the entire structure is painted a uniform slate gray to mimic the appearance of ancient megaliths.","The site is surrounded by native short-grass prairie that thrives in the arid climate of western Nebraska. Visitors will find hardy buffalo grass and seasonal sunflowers that bloom in the late summer, attracting local pollinators and grassland birds like the Meadowlark. While the installation itself is man-made, the surrounding acreage is a peaceful slice of the Great Plains ecosystem, often visited by hawks and prairie falcons searching for small rodents in the tall grass.","Created by Jim Reinders as a memorial to his father, Carhenge was dedicated during the June Solstice of 1987. It serves as a quirky, industrial tribute to the agrarian and automotive history of the United States. Over the years, it has evolved from a local curiosity into an international landmark, representing the unique brand of 'prairie art' that characterizes the region. It stands as a testament to creative engineering and remains one of the most photographed roadside attractions in the Midwest. Description is a courtesy of Gemini.",https://carhenge.com/wp-content/uploads/2020/10/cropped-carhenge1riseabove300dpi.jpg
Niobrara State Park,89264 522 Ave Niobrara NE 68760,42.7533,-98.0519,45,92,"River Views,Canoeing,Kayaking,Camping,Fishing,Hiking Trails,Wildlife Sightings,Birdwatching,Bridge Crossings,Paved Roads,Dirt Trails,Uphill Walk,Minimal Shade,Photography Spot,Visitor Center,Restrooms On-Site,Showers Available,Picnic Area,Playground,Historical Markers,Native Plant Life,Deciduous Trees,Bluff Views,Seasonal Wildflowers,Cabins Available,Horseback Riding,Bald Eagle Sightings,Catfishing,River Access,Guided Tours,Educational Signage,River Confluence,Missouri River Valley,Sandbar Observation,Wooded Ravines,Hardwood Forest,Autumn Foliage,Ponca History,Standing Bear Trail,Waterfowl Sightings,Lewis and Clark Context","Located at the confluence of the Niobrara and Missouri Rivers, this park features dramatic bluffs and rolling hills that overlook the wide river valleys. The geography is characterized by deep ravines and sandy riverbanks, with trails that wind along the edge of the limestone cliffs. The elevation changes offer stunning overlooks where the two mighty rivers merge, creating a complex water system that has shaped the northeastern Nebraska landscape for centuries.","The park is a lush haven for biodiversity, featuring a mix of oak-woodland and riverine forest. Nature enthusiasts can spot bald eagles nesting in the high cottonwood trees and white-tailed deer roaming the undergrowth. The river itself is home to prehistoric pallid sturgeon and various catfish species. In the autumn, the foliage turns vibrant shades of gold and red, making it one of the premier locations in the state for witnessing the seasonal transition of the hardwood forest.","This area holds deep cultural significance as the ancestral home of the Ponca Tribe and the site of the Standing Bear trail. The park preserves the history of early river navigation and the Mormon pioneers who crossed these waters on their westward trek. Today, it remains a cornerstone of Nebraska's state park system, offering an outdoor classroom for environmental conservation and a sanctuary for those looking to connect with the state's rich riparian heritage. Description is a courtesy of Gemini.",https://www.touristsecrets.com/wp-content/uploads/2024/10/breathtaking-views-at-niobrara-state-parks-river-overlook-1728487208.jpg
Toadstool Geologic Park,12501 Toadstool Rd Crawford NE 69339,42.8511,-103.6069,55,90,"Badlands Terrain,Fossil History,Photography Spot,Hiking Trails,Extreme Sun Exposure,No Shade,Wind Exposure,Clay Soil,Stargazing Spot,Geological Marvel,Ancient Riverbed,Minimal Cell Service,Dirt Road Access,Primitive Camping,Educational Signage,Native Plant Life,Cactus Sightings,Wildlife Sightings,Rattlesnake Hazard,Pet Friendly,Historic Sod House,Oregon Trail Context,Photography Spot,Unique Formations,Rock Scrambling,Loose Gravel,High Elevation,Arid Climate,Birdwatching,Sunset Views,Eocene Fossils,Mushroom Rocks,Volcanic Ash Layers,Oglala National Grassland,Nature Photography,Benches Available,Remote Location,Paleontology,Sandstone Caps,Gully Hiking","Toadstool Geologic Park is often described as the 'moonscape of Nebraska' due to its bizarre mushroom-shaped sandstone formations. These structures were created by the uneven erosion of volcanic ash layers and harder sandstone caprocks. The terrain consists of ancient, fossilized riverbeds and clay badlands that date back over 30 miles. The deep gullies and jagged ridges provide a challenging environment for hikers, requiring careful footing on the slippery clay surfaces.","Despite the harsh, desert-like conditions, the park is home to a specialized ecosystem of desert-hardy plants, including prickly pear cactus and yucca. The area is famous for its 'Eocene Epoch' fossils, where footprints of ancient rhinoceros-like creatures can still be seen embedded in the rock. Travelers may spot vultures circling above the ridges or horned lizards darting between the rocks. The stark beauty of the landscape is heightened by the lack of vegetation, exposing the raw, colorful layers of the earth's history.","The park features a reconstructed 1930s sod house, providing a glimpse into the grueling life of early Great Plains homesteaders who lived in 'soddies' due to the lack of timber. The site has long been a place of wonder, from Native American tribes who utilized the high vantage points for scouting to modern paleontologists who study the rich fossil record. It is managed by the Oglala National Grassland and remains a protected site for scientific research and rugged outdoor exploration. Description is a courtesy of Gemini.",https://visitnebraska.com/sites/default/files/inline-images/Toadstool_Geologic_Park_SEHK-0yp9SLYDMv5wPd4sus18q0ABlZBh_rgb_l_0.jpg
Platte River State Park,14421 346th St Louisville NE 68037,40.9180,-96.1448,25,88,"Family Friendly,Waterfall Site,Observation Tower,Paved Trails,Shaded Path,Deciduous Forest,Camping,Cabins,Photography Spot,Birdwatching,Wildlife Sightings,Deer Sightings,Fishing,Canoeing,Paddleboarding,Playground,Restrooms On-Site,Visitor Center,Gift Shop,Educational Signage,Picnic Area,Pet Friendly,Archery Range,Shooting Range,Mountain Biking,River Access,Seasonal Wildflowers,Autumn Foliage,Guided Tours,Loess Hills,Limestone Waterfall,Teepee Rentals,Platte River Bluffs,Bur Oak Trees,Hickory Forest,Warbler Sightings,Stone Creek,Nature Center,Outdoor Classroom,Amphitheater","Nestled between Omaha and Lincoln, this park features rolling, timbered hills and picturesque bluffs overlooking the Platte River. The geography is dominated by a dense forest canopy and a charming limestone waterfall located along a short, accessible hiking trail. The terrain is much gentler than western Nebraska, consisting of loess hills and fertile river bottomlands that provide a cool, shaded environment even during the peak of summer.","The park's nature is a vibrant showcase of the eastern deciduous forest, with towering bur oaks, hickories, and walnuts. The 'Stone Creek' waterfall area is a micro-ecosystem supporting ferns and mosses that are rare in other parts of the state. White-tailed deer, wild turkeys, and red fox are common sights along the trail. During the spring migration, the park becomes a hotspot for colorful warblers and other songbirds, making it a favorite for local birdwatchers.","Platte River State Park is a modern hub for outdoor recreation, but it preserves the cultural legacy of the early settlers who utilized the Platte River as a 'Great American Highway' to the west. The park's observation towers allow visitors to see for miles, mirroring the vantage points once sought by scouts and pioneers. It has become one of Nebraska's most popular destination parks, blending high-end amenities like the Mallet Lodge with the raw beauty of the river valley. Description is a courtesy of Gemini.",https://theomahamom.com/wp-content/uploads/2023/07/Platte-River-State-Park-Waterfall-and-Creek.png
Smith Falls State Park,90159 Smith Falls Rd Valentine NE 69201,42.8894,-100.3150,30,95,"Waterfall,Highest Waterfall in NE,Niobrara River,Shaded Path,Wooden Bridge,Photography Spot,Swimming,Canoeing,Kayaking,Wildlife Sightings,Birdwatching,Picnic Area,Restrooms On-Site,Camping,Visitor Center,Educational Signage,Native Plant Life,Unique Microclimate,Aspen Trees,Birch Trees,Cool Mist,Family Friendly,Seasonal Wildflowers,River Access,Stargazing Spot,Boardwalk Path,Minimal Cell Service,National Scenic River,Nature Preserve,Ice Age Remnant,Spring Fed,Boardwalk,Iron Bridge,Canyon Habitat,Eco-Conservation,Sandhills Edge,River Tubing,Mosses and Ferns,Blue Heron Habitat","Smith Falls is home to Nebraska's highest waterfall, a 70-foot drop created by a spring-fed stream cascading over a limestone ledge into the Niobrara River valley. The geography is unique because the cool, moist canyon creates a 'biological island' that is much cooler than the surrounding sandhills. The trail features a historic iron bridge that crosses the Niobrara River, providing access to the boardwalk that leads directly to the base of the falls.","Because of the unique microclimate, Smith Falls is the only place in the Great Plains where you can find paper birch and quaking aspen trees, remnants of the last Ice Age. The mist from the falls supports a lush growth of mosses and liverworts that are found nowhere else in the region. Wildlife is abundant, with blue herons frequently spotted along the river and various amphibious species thriving in the cool, damp environment near the splash pool.","The falls are named after Frederic Smith, who filed the first homestead patent on the land. In 1992, the area was established as a state park to protect the fragile ecosystem and the waterfall. It has since become the crowning jewel of the Niobrara National Scenic River, serving as a popular stopping point for thousands of tubers and canoers who navigate the river each summer. It stands as a symbol of Nebraska's hidden natural diversity and environmental conservation. Description is a courtesy of Gemini.",https://heroesofadventure.com/wp-content/uploads/2018/02/b913d2df78150ac07bcd72649427f7c0.jpg
Indian Cave State Park,65296 720 Rd Shubert NE 68437,40.2633,-95.5333,60,90,"Cave,Petroglyphs,Missouri River,Steep Trails,Hardwood Forest,Autumn Foliage,Photography Spot,Camping,Historical Markers,Native American History,Wildlife Sightings,Birdwatching,Deer Sightings,Wild Turkeys,Horseback Riding,Mountain Biking,Picnic Area,Restrooms On-Site,Visitor Center,Educational Signage,River Overlooks,Minimal Cell Service,Stargazing Spot,Seasonal Wildflowers,Mushroom Foraging,Winter Sledding,Historic Cemetery,Loess Bluffs,River Confluence Context,Sandstone Alcove,Rock Carvings,Ghost Town Site,St. Deroin History,Oak-Hickory Forest,Missouri Flyway,Nature Photography,Sunrise Overlooks,Rugged Hiking,River Erosion","Located in the deep southeast corner of the state, this park is famous for its large sandstone alcove and steep, rugged hills. The geography is characterized by deep loess bluffs that tower over the Missouri River, offering some of the most dramatic elevation changes in eastern Nebraska. The 'Indian Cave' itself is a natural formation carved by wind and water into the soft sandstone, sitting at the base of a high ridge.","The park is dominated by an ancient hardwood forest of oak and hickory, which creates a dense canopy that turns into a kaleidoscope of colors in October. It is a premier spot for seeing wild turkeys and large herds of white-tailed deer. The rare timber rattlesnake can occasionally be found in the remote rocky outcrops, and the park is a vital stopover for migratory birds traveling the Missouri River flyway.","The park's most famous feature is the ancient petroglyphs (rock carvings) found inside the cave, believed to have been made by Native Americans thousands of years ago. The site also contains the remains of the town of St. Deroin, a mid-1800s river settlement that was eventually swallowed by the shifting river. Today, the park is a blend of mysterious ancient history and modern outdoor adventure, preserving the legends of the river people. Description is a courtesy of Gemini.",https://mainstreamadventures.com/wp-content/uploads/2021/10/indiancavesp.jpg
Fort Robinson State Park,3200 US-20 Crawford NE 69339,42.6947,-103.4614,40,94,"Historic Fort,Badlands,High Bluffs,Paved Roads,Dirt Trails,Horseback Riding,Wildlife Sightings,Buffalo Herd,Longhorn Cattle,Birdwatching,Photography Spot,Museum,Visitor Center,Restrooms On-Site,Camping,Cabins,Playground,Picnic Area,Educational Signage,Native American History,Military History,Geological Marvel,Buttes,Seasonal Wildflowers,Guided Tours,Stagecoach Rides,Indoor Pool,Stargazing Spot,Minimal Cell Service,Pine Ridge Region,Red Cloud Buttes,Ponderosa Pines,Bighorn Sheep,Mountain Lion Habitat,Crazy Horse Memorial Site,Cavalry Remount Station,POW Camp Context,Old West History,Nature Photography,Butte Overlooks","Fort Robinson is set against the stunning backdrop of the Pine Ridge region, featuring towering red-rimmed buttes and expansive pine-covered ridges. The geography is a dramatic mix of lush valley grasslands and jagged ponderosa pine forests. The high plateaus offer incredible views of the surrounding Crawford area, with unique geological formations like the 'Red Cloud Buttes' dominating the northern horizon.","This park is one of the best places in Nebraska to see large North American mammals in a natural setting. It maintains a massive herd of American Buffalo (Bison) and Texas Longhorn cattle. In the higher ridges, bighorn sheep have been successfully reintroduced and can often be seen perched on the rocky ledges. The nature trails wind through ponderosa pine forests that are home to mountain lions, mule deer, and a vast array of predatory birds like golden eagles.","Fort Robinson has a complex and somber history; it was a former U.S. Army post and the site where the great Sioux leader Crazy Horse was killed in 1877. It later served as a cavalry remount station and even a POW camp during World War II. Today, it is Nebraska's premier historical park, offering a massive array of museums and activities that allow visitors to step back into the era of the Old West and the Indian Wars. Description is a courtesy of Gemini.",https://ejphoto.com/images_NE/NE_RedCloudButtes03.jpg
Wildcat Hills SRA,210615 NE-71 Gering NE 69341,41.7780,-103.6156,50,89,"Pine Ridges,High Elevation,Buttes,Canyons,Dirt Trails,Steep Inclines,Panoramic Views,Photography Spot,Wildlife Sightings,Birdwatching,Visitor Center,Nature Center,Educational Signage,Picnic Area,Restrooms On-Site,Stargazing Spot,Native Plant Life,Ponderosa Pines,Wildflowers,Wild Turkey,Mule Deer,Photography Spot,Sunset Views,Minimal Cell Service,Shooting Range,Archery,Mountain Biking,Family Friendly,Escarpment,Sandstone Cliffs,Volcanic Ash Layers,Bighorn Sheep Habitat,Mountain Bluebirds,Nature Education,Sunrise Overlooks,Arid Climate,Photography Point,Benches Available,Wildlife Observation,Panhandle Landmark","The Wildcat Hills are a rugged escarpment that rises abruptly from the surrounding North Platte Valley. The geography is defined by deep canyons, rocky ridges, and high buttes composed of ancient sandstone and volcanic ash. The trails offer significant elevation changes, providing hikers with a taste of the 'mountain' terrain that pioneers described as they left the flat prairies of the east.","The Hills are covered in a dense forest of Ponderosa Pine and Rocky Mountain Juniper, creating an evergreen oasis in the middle of the high plains. The area is a vital habitat for bighorn sheep and mountain lions, though they are elusive to most visitors. Birdwatchers can see mountain bluebirds and various hawks, while the wildflower displays in early summer bring splashes of purple and gold to the rugged canyon floors.","Wildcat Hills has served as a landmark and lookout point for thousands of years, from nomadic Native American tribes to early fur traders. The Nature Center on-site is an architectural marvel, built to blend into the cliffs, and provides extensive education on the prehistoric life of the region. It remains a popular spot for locals and tourists alike to experience the 'wild' side of Nebraska's panhandle. Description is a courtesy of Gemini.",https://bryanberg.net/files/wp-content/uploads/wildcat02.jpg
