name,address,latitude,longitude,difficulty,satisfaction,tags,description_geography,description_nature,description_culture,image
Klasey Park,"Klasey Park, South Sioux City, Nebraska, 68776",42.4789,-96.4144,0,0,"Northeast Nebraska, Missouri River Valley, Family Friendly, Dog Friendly, Pet Friendly, Playground, Picnic Area, Picnic Shelters, Community Gathering, Local Events, Stroller Friendly, Accessible Trail, Paved Path, Short Walk, Easy Walk, Peaceful Walk, Year Round Access, Free Entry, Parking Available, Restrooms On-Site, Drinking Water, Grills Available, Urban Park, Small Town Access, Cottonwood Trees, Willow Trees, Bur Oak Forest, Wildlife Sightings, Birdwatching, Songbirds, Meadowlark Sightings, Squirrel Sightings, Rabbit Sightings, Raccoon Sightings, Seasonal Wildflowers, Spring Blooms, Butterfly Garden, Pollinator Habitat, Photography Point, Nature Photography, Landscape Photography, Open Space, Shaded Path, Flat Path, Leash Required, No Littering, City Park","Klasey Park is situated in South Sioux City in the northeastern corner of Nebraska, positioned within the Missouri River Valley region. The terrain features the characteristic flat to gently rolling topography typical of the Missouri River floodplain, with elevations that remain relatively low compared to western Nebraska. The landscape is shaped by glacial deposits and river sediments laid down over millennia, creating fertile soils that support both urban development and green spaces. The park sits on land that was historically influenced by the meandering patterns of the Missouri River, with its geological foundation consisting of alluvial deposits including clay, silt, and sand layers. The surrounding area features loess hills formations to the east, remnants of wind-deposited sediments from the last ice age. The local geology includes Quaternary-age sediments that overlie much older Cretaceous bedrock formations far below the surface.","The park's ecosystem represents a blend of maintained urban green space and naturalized areas typical of Missouri River Valley habitats. Native and ornamental trees provide shade and wildlife habitat, including species like cottonwood, willow, and bur oak that naturally occur in riparian zones. The understory and maintained areas support various grasses and seasonal wildflowers that attract pollinators including butterflies, bees, and dragonflies during warmer months. Bird species common to the area include songbirds such as meadowlarks, robins, and cardinals, along with migratory waterfowl that use the Missouri River corridor. The park provides habitat for small mammals including squirrels, rabbits, and raccoons, while the nearby river ecosystem supports aquatic life and associated wildlife. Spring and summer bring active breeding birds and abundant insect life, while autumn features migrating species passing through the Central Flyway. The maintained landscapes provide important green space within the urban environment, offering refuge for wildlife adapted to human-modified habitats.","Klasey Park serves as an important community gathering space in South Sioux City, a community with deep agricultural and industrial roots tied to the Missouri River. The area's history reflects the broader settlement patterns of northeastern Nebraska, where European immigrants established farms and towns in the late 19th and early 20th centuries. South Sioux City developed as a companion city to Sioux City, Iowa, across the Missouri River, with strong connections to meatpacking, transportation, and agriculture industries. The park provides recreational opportunities for a diverse community that has grown significantly in recent decades, reflecting demographic changes throughout the region. Local residents use the park for family gatherings, youth sports, community events, and casual recreation, making it a vital component of the city's social infrastructure. The park embodies the Great Plains tradition of creating public green spaces that serve multiple generations and provide respite from urban life. Its location near the Missouri River connects it to the broader historical significance of the river as a transportation route, boundary marker, and life-sustaining resource for countless communities throughout history.",
Lake Hastings Park,"South Shore Drive, Hastings, Nebraska, 68902",40.6087,-98.3952,0,0,"Republican River Valley, Central Nebraska, Man-Made Lake, Reservoir, Lake Views, Water Management, Conservation Site, Dam Site, State Recreation Area, Family Friendly, Dog Friendly, Pet Friendly, Fishing, Bass Fishing, Catfishing, Boating, Canoeing, Kayaking, Swimming, Beach Access, Waterfowl, Great Blue Heron, Pelican Sightings, Birdwatching, Songbirds, Meadowlark Sightings, Dickcissel Sightings, White-Tailed Deer, Raccoon Sightings, Wildlife Sightings, Cottonwood Trees, Willow Trees, Prairie Grass, Native Plant Life, Seasonal Wildflowers, Aquatic Plants, Aquatic Life, Picnic Area, Picnic Shelters, Playground, Paved Trail, Easy Walk, Peaceful Walk, Family Friendly, Stroller Friendly, Year Round Access, Parking Available, Free Parking, Restrooms On-Site, Drinking Water, Boat Ramps, Fish Cleaning Station, Photography Point, Sunset Views, Scenic Overlook, Community Gathering, Local Events, Summer Festival, Agricultural History, Irrigation History, Small Town Access, Popular Destination, Stocked Lake, Fishing License Required, Leash Required, Public Access, Urban Park, Water Education, Environmental Education, Nature Photography, Landscape Photography, Wildlife Photography","Lake Hastings Park is situated in the Republican River Valley of south-central Nebraska, within the High Plains physiographic region. The park surrounds Lake Hastings, a man-made reservoir created for municipal water supply and recreation. The terrain features gently rolling topography characteristic of the Republican River watershed, with elevations ranging from the lake surface to slightly elevated bluffs overlooking the water. The landscape consists of modified prairie terrain with earthen dam structures and engineered shorelines. The underlying geology includes Quaternary alluvial deposits overlying Cretaceous-age sedimentary rocks typical of south-central Nebraska. The lake basin was formed through damming and excavation, creating a water body that contrasts with the surrounding agricultural plains. Soil composition includes loess-derived silts and clays mixed with sandy alluvium from the Republican River system, providing diverse substrate conditions around the lake perimeter.","Lake Hastings Park supports a mix of aquatic and terrestrial ecosystems adapted to central Nebraska's transitional climate zone. The lake provides habitat for various fish species including bass, catfish, and panfish, making it a productive fishery. Waterfowl frequent the lake during spring and fall migrations, with ducks, geese, and occasional pelican sightings. Great blue herons and other wading birds hunt along the shorelines. The surrounding landscape features a combination of managed grasslands, scattered cottonwood and willow trees near the water's edge, and introduced shade trees in developed areas. Songbirds including meadowlarks and dickcissels inhabit the grassland margins. White-tailed deer, raccoons, and other common Nebraska wildlife visit the park. The lake supports aquatic plants in shallow areas, while upland zones feature native and introduced prairie grasses. Seasonal wildflowers appear in undeveloped sections, and the park's diverse habitats create opportunities for wildlife observation throughout the year.","Lake Hastings was developed as part of Hastings' municipal water supply infrastructure, reflecting Nebraska's long history of water management and reservoir construction essential to Great Plains settlement and urban development. The park represents mid-20th century approaches to combining utility infrastructure with recreational amenities, serving the community of Hastings, an important south-central Nebraska city founded along the Burlington Railroad in the 1870s. The area reflects the agricultural heritage of Adams County, where irrigation and water conservation have been critical to farming success. The park has become a central recreational hub for local residents, hosting fishing, boating, picnicking, and seasonal community events. It exemplifies Nebraska's tradition of creating public lake parks that serve multiple purposes—water supply, flood control, and outdoor recreation. The site represents the transformation of Republican River Valley landscapes through human engineering while maintaining accessible green space for a prairie community. Hastings itself has historical significance as a railroad town and agricultural center, and the park contributes to quality of life in this classic Nebraska community.",

Atokad Park,"Stable Drive, North Shore, Nebraska, 68776",42.4414,-96.4302,0,0,"State Recreation Area, Northeast Nebraska, Lake Views, River Access, Family Friendly, Dog Friendly, Pet Friendly, Fishing, Bass Fishing, Catfishing, Boating, Kayaking, Canoeing, Beach Access, Swimming, Playground, Picnic Area, Picnic Shelters, Camping, Primitive Camping, RV Hookups, Boat Ramps, Parking Available, Free Parking, Paved Parking Lot, Restrooms On-Site, Drinking Water, Fire Pits, Grills Available, Year Round Access, Birdwatching, Waterfowl, Songbirds, Meadowlark Sightings, Dickcissel Sightings, White-Tailed Deer, Wildlife Sightings, Cottonwood Trees, Willow Trees, Native Plant Life, Seasonal Wildflowers, Aquatic Life, Wetland Habitat, Riparian Zone, Stroller Friendly, Wheelchair Accessible, Easy Walk, Short Walk, Paved Trail, Flat Path, Photography Point, Nature Photography, Wildlife Photography, Landscape Photography, Peaceful Walk, Quiet Environment, Hidden Gem, Community Gathering, Local Events, Water Required, Sun Protection Required, Tick Habitat, Mosquito Season, Fishing License Required, Leash Required, Sunset Views, Scenic Overlook, Conservation Site","Atokad Park is situated in the gently rolling terrain characteristic of the North Shore area near the shores of Wildwood Lake in northeast Nebraska. The landscape features relatively flat to slightly undulating topography typical of glacially-influenced regions, with clay and loess soils that were deposited during the Pleistocene epoch. The park sits at a modest elevation with gradual slopes leading toward the lake's edge, where sandy shoreline transitions into the water. The underlying geology consists of sedimentary layers that have been shaped by ancient glacial activity and subsequent erosion. Drainage patterns flow naturally toward the lake, and the terrain includes both well-drained upland areas and lower-lying zones that may experience seasonal moisture accumulation. The park's position near the lake provides subtle elevation changes and scenic views across the water, with the terrain allowing for easy access to both terrestrial and aquatic environments within this northeast Nebraska setting.","The natural environment of Atokad Park showcases a blend of grassland and riparian ecosystems common to northeast Nebraska's lake country. Native and naturalized grasses provide habitat for songbirds including meadowlarks and dickcissels, while the proximity to Wildwood Lake creates opportunities for waterfowl observations, particularly during spring and fall migrations. The park's vegetation includes cottonwood and willow trees near the water's edge, transitioning to mixed grasses in upland areas. Aquatic habitats support fish populations including bass, catfish, and panfish species that attract both wildlife and anglers. White-tailed deer are frequently observed in the area, along with raccoons, ground squirrels, and various small mammals. The wetland margins provide important habitat for amphibians and reptiles, including painted turtles and various frog species. Seasonal wildflowers add color to the landscape during spring and summer months, while the diverse plant communities support numerous pollinator species including butterflies and native bees throughout the growing season.","Atokad Park represents a typical development of recreational infrastructure in rural Nebraska during the mid-to-late 20th century, when communities recognized the value of lakeside access for public recreation. The park serves as a community gathering space for the small population of the North Shore area and surrounding Norfolk region. Its development reflects Nebraska's ongoing efforts to provide accessible outdoor recreation opportunities, particularly focused on water-based activities and family-friendly environments. The park has become integrated into local traditions, hosting family reunions, seasonal celebrations, and serving as a launching point for fishing and boating activities on Wildwood Lake. The area's agricultural heritage remains visible in the surrounding landscape, with the park representing a transition from purely agricultural land use to recreational purposes. Local residents have maintained the park through community involvement and volunteer efforts, demonstrating the strong connection between small Nebraska communities and their public spaces. The park continues to serve educational purposes, introducing younger generations to outdoor recreation and environmental stewardship values that are deeply rooted in Nebraska culture.",
Burley Park,"Maple Street, Friend, Nebraska, 68359",40.6422,-97.2870,0,0,"Southeast Nebraska, Republican River Valley, Mixed Grass Prairie, Small Town Access, Community Gathering, Pioneer History, Homestead Site, Agricultural History, Farming Context, Prairie Grass, Big Bluestem, Switchgrass, Buffalo Grass, Native Plant Life, Seasonal Wildflowers, Spring Wildflowers, Summer Wildflowers, Coneflowers, Goldenrod, Prairie Sunflowers, Cottonwood Trees, Bur Oak Forest, Wildlife Sightings, Birdwatching, Songbirds, Meadowlark Sightings, Dickcissel Sightings, Wild Turkey, White-Tailed Deer, Cottontail Rabbits, Ground Squirrels, Butterfly Garden, Pollinator Habitat, Family Friendly, Dog Friendly, Picnic Area, Playground, Local Events, Flat Path, Easy Walk, Short Walk, Stroller Friendly, Free Entry, Parking Available, Year Round Access, Community Park, Nature Photography, Peaceful Walk, Quiet Environment, Hidden Gem, Restrooms On-Site, Open Space, High Plains Climate","Burley Park is situated in the gently rolling agricultural landscape characteristic of Southeast Nebraska, within the Republican River Valley region. The terrain consists of relatively flat to slightly undulating prairie lands that have been shaped by centuries of erosion and sediment deposition from nearby waterways. The soil composition is primarily rich loess, clay, and sandy loam deposited during glacial periods, making this area exceptionally fertile. The park lies at a modest elevation typical of the Central Plains, with minimal elevation changes throughout the grounds. The underlying geology features sedimentary layers from the Cretaceous and Tertiary periods, though these are deeply buried beneath prairie soils. The landscape reflects the transition zone between the tallgrass prairies of eastern Nebraska and the mixed-grass prairies further west, creating a unique ecological setting within the Republican River Valley drainage system.","The natural environment of Burley Park represents the mixed-grass prairie ecosystem common to Southeast Nebraska, featuring native grasses such as big bluestem, switchgrass, and buffalo grass interspersed with cultivated areas. Seasonal wildflowers including coneflowers, goldenrod, and prairie sunflowers provide colorful displays during spring and summer months. The park serves as habitat for numerous songbird species, with meadowlarks and dickcissels being particularly common. Birdwatching opportunities include sightings of hawks, wild turkeys, and various waterfowl during migration seasons. White-tailed deer frequently browse the edges of the park, while smaller mammals like cottontail rabbits and ground squirrels are abundant. The riparian zones and scattered trees provide nesting sites for numerous bird species and cover for wildlife. Cottonwood and bur oak trees offer shade and contribute to the diverse plant community. The ecosystem supports pollinators including butterflies and native bees, which are essential for the health of both native and cultivated plants in the surrounding agricultural landscape.","Burley Park serves the small community of Friend, Nebraska, a town established in the late 19th century during the westward expansion and railroad development era. The park reflects the strong community values and agricultural heritage typical of rural Southeast Nebraska towns founded by homesteaders and pioneer families. Friend, incorporated in 1874, was named after a railroad official and grew as a farming community along the railroad corridor. The park has long served as a gathering place for local residents, hosting community events, family reunions, and small-town celebrations that are central to rural Nebraska culture. The surrounding area bears the marks of homestead history, with the land once claimed under the Homestead Act and transformed from open prairie to productive farmland. Local residents maintain the park as a testament to community pride and the importance of public spaces in small-town life. The park embodies the frontier history and pioneer spirit that shaped this region, serving as a green space where generations of families have created memories and maintained connections to their agricultural roots and close-knit community traditions.",https://upload.wikimedia.org/wikipedia/commons/thumb/e/e6/Train_passing_through_Burley_Park_station_%28geograph_6255213%29.jpg/800px-Train_passing_through_Burley_Park_station_%28geograph_6255213%29.jpg
Gilman Park,"North Mason Street, Pierce, Nebraska, 68767",42.2008,-97.5217,0,0,"Northeast Nebraska, Community Gathering, Family Friendly, Stroller Friendly, Dog Friendly, Pet Friendly, Playground, Picnic Area, Picnic Shelters, Deciduous Forest, Bur Oak Forest, Cottonwood Trees, Shaded Path, Songbirds, Meadowlark Sightings, Warbler Sightings, White-Tailed Deer, Birdwatching, Wildlife Sightings, Monarch Butterfly Migration, Butterfly Garden, Pollinator Habitat, Seasonal Wildflowers, Spring Wildflowers, Summer Wildflowers, Firefly Sightings, Prairie Education, Small Town Access, Local Events, Fourth of July, Elkhorn River Valley, Loess Hills, Clay Soil, Glacial Lake, Agricultural History, Farming Context, Pioneer History, Homestead Site, Railroad History, Peaceful Walk, Easy Walk, Short Walk, Nature Photography, Photography Point, Free Entry, Parking Available, Restrooms On-Site, Drinking Water, Grills Available, Year Round Access, Quiet Environment, Hidden Gem, Conservation Education, Environmental Education, Leave No Trace, Leash Required","Gilman Park is situated in the gently rolling terrain characteristic of northeastern Nebraska's agricultural landscape near Pierce. The park occupies land that was shaped by ancient glacial activity, with rich soils deposited over millennia creating the fertile ground that defines this region. The topography features subtle elevation changes typical of the transition zone between the Missouri River Valley influences to the east and the Sandhills Region to the west. The underlying geology consists of layers of glacial till and loess deposits that have weathered into productive farmland surrounding the community park setting. Surface drainage patterns reflect the area's position within the Elkhorn River Valley watershed system. The terrain is predominantly flat to gently undulating, with mature trees providing vertical relief in an otherwise horizontal landscape. Clay-rich soils characterize the substrate, which can become sticky and challenging during wet periods, a common feature of this glacially-influenced geography.","The park's ecosystem represents a small but valuable green space within the agricultural matrix of Pierce County. Mature deciduous trees, including bur oaks, cottonwoods, and elms, provide canopy coverage and habitat for numerous songbird species including meadowlarks, robins, and various warbler species during migration. The understory and lawn areas attract ground-feeding birds and small mammals such as cottontail rabbits and fox squirrels. Native and ornamental plantings may include seasonal wildflowers that bloom from spring through fall, attracting pollinators including monarch butterflies during their migration periods, honeybees, and bumblebees. White-tailed deer occasionally visit the park edges during early morning or evening hours. The park serves as a stopover habitat for migratory birds traveling the Central Flyway, with spring and fall bringing increased avian diversity. Insect life is abundant during warmer months, including dragonflies, grasshoppers, and fireflies on summer evenings. The maintained landscape balances recreational use with opportunities for wildlife observation and nature connection in this small-town prairie setting.","Gilman Park represents the community gathering tradition central to small-town Nebraska life, serving Pierce residents as a recreational and social hub since its establishment. Named likely after a prominent local family or benefactor, the park reflects the agricultural community's values of public space and civic pride. Pierce itself was founded along railroad lines in the late 19th century, growing as a agricultural service center for surrounding farms and ranches settled during the homestead era. The park has hosted generations of community events, family reunions, youth sports, Fourth of July celebrations, and informal gatherings that strengthen social bonds in rural Nebraska. Its location on North Mason Street places it within easy walking distance for town residents, embodying the pedestrian-friendly scale of small Great Plains communities. The park facilities reflect investment in quality of life amenities that help sustain rural towns facing demographic challenges. Trees planted decades ago now provide shade and character, representing continuity and community stewardship across generations. The park continues to serve as an important venue for maintaining small-town culture and community identity in northeast Nebraska's agricultural heartland.",
